{
  "schema": "AIFC/normative-assurance-root-registry/v3",
  "registry_id": "AIFC-NORMATIVE-ASSURANCE-ROOTS-V3",
  "predecessor_registry_id": "AIFC-NORMATIVE-ASSURANCE-ROOTS-V2",
  "predecessor_registry_path": "conformance/AIFC-NORMATIVE-ASSURANCE-ROOTS-v2.json",
  "predecessor_registry_git_blob_sha1": "d2bb7f3917f8761836825a4e80f03c1e282fc37d",
  "predecessor_exact_main_commit": "eeee61c6143cde1bea64c643def6eaec461e7aa2",
  "predecessor_exact_tree_sha": "2e939271d22d0a1906c93bd7e0fced77780aa88c",
  "activation_transition_id": "AIFC-SAL-LINEAGE-ACTIVATION-eeee61c-V1",
  "registry_authority_status": "SUCCESSOR_REGISTRY_CANDIDATE_REQUIRES_NEXT_LINEAGE_ATTESTATION",
  "records": [
    {"artifact_id":"AIFC-RELEASE-GATE-v1.0.8-draft","kind":"RELEASE_GATE","expected_schema":"AIFC/conformance-release-gate/v1","relative_path":"conformance/AIFC-RELEASE-GATE-v1.0.8-draft.json","git_blob_sha1":"656bda0bae1d1af515a642f157149450c78d879e","authority_status":"HISTORICAL_ROOT_AT_PREDECESSOR_COMMIT","authority_commit":"7e58b47398fe585b24db6304ee6122871095d668","authority_receipt_id":null},
    {"artifact_id":"AIFC-ADMISSION-AUTHORITY-PARTIAL-ORDER-V1","kind":"ADMISSION_ORDER","expected_schema":"AIFC/admission-authority-order/v1","relative_path":"conformance/AIFC-ADMISSION-AUTHORITY-ORDER-v1.json","git_blob_sha1":"38eeb695caf781dcdc79115d4903c743db7311f9","authority_status":"HISTORICAL_ROOT_AT_PREDECESSOR_COMMIT","authority_commit":"7e58b47398fe585b24db6304ee6122871095d668","authority_receipt_id":null},
    {"artifact_id":"AIFC-RELEASE-GATE-v1.0.9-draft","kind":"RELEASE_GATE","expected_schema":"AIFC/conformance-release-gate/v1","relative_path":"conformance/AIFC-RELEASE-GATE-v1.0.9-draft.json","git_blob_sha1":"e46cfee9963e61a22bc25e4e68ac5f11781e8d47","authority_status":"ATTESTED_SUCCESSOR_AT_COMMIT","authority_commit":"7e58b47398fe585b24db6304ee6122871095d668","authority_receipt_id":"AIFC-SAL-V1.2-EXACT-MAIN-RECEIPT-7e58b47"},
    {"artifact_id":"AIFC/assurance-evidence-hash/v1","kind":"ASSURANCE_HASH_PROFILE","expected_schema":"AIFC/assurance-hash-profile-manifest/v1","relative_path":"conformance/AIFC-ASSURANCE-HASH-PROFILE-MANIFEST-v1.json","git_blob_sha1":"2f061fe9244369ba43819771e2cf22a8642c2fe8","authority_status":"ATTESTED_SUCCESSOR_AT_COMMIT","authority_commit":"7e58b47398fe585b24db6304ee6122871095d668","authority_receipt_id":"AIFC-SAL-V1.2-EXACT-MAIN-RECEIPT-7e58b47"},
    {"artifact_id":"AIFC-INHERITED-GATE-OBLIGATION-HASH-V1","kind":"INHERITED_GATE_HASH_PROFILE","expected_schema":"AIFC/inherited-gate-hash-profile/v1","relative_path":"conformance/AIFC-INHERITED-GATE-HASH-PROFILE-v1.json","git_blob_sha1":"df68961799dad62d5aef61b48a177d46c470176c","authority_status":"ATTESTED_SUCCESSOR_AT_COMMIT","authority_commit":"7e58b47398fe585b24db6304ee6122871095d668","authority_receipt_id":"AIFC-SAL-V1.2-EXACT-MAIN-RECEIPT-7e58b47"},
    {"artifact_id":"AIFC-SCHEMA-IDENTITY-REGISTRY-V3","kind":"SCHEMA_IDENTITY_REGISTRY","expected_schema":"AIFC/schema-identity-registry/v3","relative_path":"conformance/AIFC-SCHEMA-IDENTITY-REGISTRY-v3.json","git_blob_sha1":"b5be735903ee425ae4791816555dda20f38f559d","authority_status":"ATTESTED_SUCCESSOR_AT_COMMIT","authority_commit":"eeee61c6143cde1bea64c643def6eaec461e7aa2","authority_receipt_id":"AIFC-SAL-V1.3-EXACT-MAIN-RECEIPT-eeee61c"},
    {"artifact_id":"AIFC-INHERITED-GATE-OBLIGATION-HASH-V1-IMPLEMENTATION-BINDING-V1","kind":"HASH_IMPLEMENTATION_BINDING","expected_schema":"AIFC/inherited-gate-hash-implementation-binding/v1","relative_path":"conformance/AIFC-INHERITED-GATE-HASH-IMPLEMENTATION-BINDING-v1.json","git_blob_sha1":"8750ced18dfb2c6c86605ce9a801701a9fbd595f","authority_status":"ATTESTED_SUCCESSOR_AT_COMMIT","authority_commit":"eeee61c6143cde1bea64c643def6eaec461e7aa2","authority_receipt_id":"AIFC-SAL-V1.3-EXACT-MAIN-RECEIPT-eeee61c"},
    {"artifact_id":"AIFC-RELEASE-GATE-v1.0.10-draft","kind":"RELEASE_GATE","expected_schema":"AIFC/conformance-release-gate/v1","relative_path":"conformance/AIFC-RELEASE-GATE-v1.0.10-draft.json","git_blob_sha1":"ea75fcfa47ecc327fd25533f12437df2e7647154","authority_status":"ATTESTED_SUCCESSOR_AT_COMMIT","authority_commit":"eeee61c6143cde1bea64c643def6eaec461e7aa2","authority_receipt_id":"AIFC-SAL-V1.3-EXACT-MAIN-RECEIPT-eeee61c"},
    {"artifact_id":"AIFC-SCHEMA-IDENTITY-REGISTRY-V4","kind":"SCHEMA_IDENTITY_REGISTRY","expected_schema":"AIFC/schema-identity-registry/v4","relative_path":"conformance/AIFC-SCHEMA-IDENTITY-REGISTRY-v4.json","git_blob_sha1":"4de28a045f8da0995ca0f7b07c051cce6f632881","authority_status":"SUCCESSOR_CANDIDATE_REQUIRES_EXACT_COMMIT_ATTESTATION","authority_commit":null,"authority_receipt_id":null},
    {"artifact_id":"AIFC-RELEASE-GATE-v1.0.11-draft","kind":"RELEASE_GATE","expected_schema":"AIFC/conformance-release-gate/v1","relative_path":"conformance/AIFC-RELEASE-GATE-v1.0.11-draft.json","git_blob_sha1":"dc1af9c927358865b3cd6830a8ca2eabb00ff09d","authority_status":"SUCCESSOR_CANDIDATE_REQUIRES_EXACT_COMMIT_ATTESTATION","authority_commit":null,"authority_receipt_id":null}
  ]
}
